{
  "commands": [
    {
      "abbreviation": "AB",
      "all_forms": [
        "AB",
        "ABL",
        "ABLO",
        "ABLOC",
        "ABLOCK"
      ],
      "canonical": "ABLOCK",
      "standard_status": "ansi"
    },
    {
      "abbreviation": "",
      "all_forms": [
        "ASSIGN"
      ],
      "canonical": "ASSIGN",
      "standard_status": "ansi"
    },
    {
      "abbreviation": "ASTA",
      "all_forms": [
        "ASTA",
        "ASTAR",
        "ASTART"
      ],
      "canonical": "ASTART",
      "standard_status": "ansi"
    },
    {
      "abbreviation": "ASTO",
      "all_forms": [
        "ASTO",
        "ASTOP"
      ],
      "canonical": "ASTOP",
      "standard_status": "ansi"
    },
    {
      "abbreviation": "AUNB",
      "all_forms": [
        "AUNB",
        "AUNBL",
        "AUNBLO",
        "AUNBLOC",
        "AUNBLOCK"
      ],
      "canonical": "AUNBLOCK",
      "standard_status": "ansi"
    },
    {
      "abbreviation": "B",
      "all_forms": [
        "B",
        "BR",
        "BRE",
        "BREA",
        "BREAK"
      ],
      "canonical": "BREAK",
      "standard_status": "ansi"
    },
    {
      "abbreviation": "",
      "all_forms": [
        "CATCH"
      ],
      "canonical": "CATCH",
      "standard_status": "iris-extension"
    },
    {
      "abbreviation": "C",
      "all_forms": [
        "C",
        "CL",
        "CLO",
        "CLOS",
        "CLOSE"
      ],
      "canonical": "CLOSE",
      "standard_status": "ansi"
    },
    {
      "abbreviation": "",
      "all_forms": [
        "CONTINUE"
      ],
      "canonical": "CONTINUE",
      "standard_status": "iris-extension"
    },
    {
      "abbreviation": "D",
      "all_forms": [
        "D",
        "DO"
      ],
      "canonical": "DO",
      "standard_status": "ansi"
    },
    {
      "abbreviation": "E",
      "all_forms": [
        "E",
        "EL",
        "ELS",
        "ELSE"
      ],
      "canonical": "ELSE",
      "standard_status": "ansi"
    },
    {
      "abbreviation": "",
      "all_forms": [
        "ELSEIF"
      ],
      "canonical": "ELSEIF",
      "standard_status": "iris-extension"
    },
    {
      "abbreviation": "ESTA",
      "all_forms": [
        "ESTA",
        "ESTAR",
        "ESTART"
      ],
      "canonical": "ESTART",
      "standard_status": "ansi"
    },
    {
      "abbreviation": "",
      "all_forms": [
        "ESTOP"
      ],
      "canonical": "ESTOP",
      "standard_status": "ansi"
    },
    {
      "abbreviation": "",
      "all_forms": [
        "ETRIGGER"
      ],
      "canonical": "ETRIGGER",
      "standard_status": "ansi"
    },
    {
      "abbreviation": "F",
      "all_forms": [
        "F",
        "FO",
        "FOR"
      ],
      "canonical": "FOR",
      "standard_status": "ansi"
    },
    {
      "abbreviation": "G",
      "all_forms": [
        "G",
        "GO",
        "GOT",
        "GOTO"
      ],
      "canonical": "GOTO",
      "standard_status": "ansi"
    },
    {
      "abbreviation": "H",
      "all_forms": [
        "H",
        "HA",
        "HAL",
        "HALT"
      ],
      "canonical": "HALT",
      "standard_status": "ansi"
    },
    {
      "abbreviation": "H",
      "all_forms": [
        "H",
        "HA",
        "HAN",
        "HANG"
      ],
      "canonical": "HANG",
      "standard_status": "ansi"
    },
    {
      "abbreviation": "I",
      "all_forms": [
        "I",
        "IF"
      ],
      "canonical": "IF",
      "standard_status": "ansi"
    },
    {
      "abbreviation": "J",
      "all_forms": [
        "J",
        "JO",
        "JOB"
      ],
      "canonical": "JOB",
      "standard_status": "ansi"
    },
    {
      "abbreviation": "K",
      "all_forms": [
        "K",
        "KI",
        "KIL",
        "KILL"
      ],
      "canonical": "KILL",
      "standard_status": "ansi"
    },
    {
      "abbreviation": "",
      "all_forms": [
        "KSUBSCRIPTS"
      ],
      "canonical": "KSUBSCRIPTS",
      "standard_status": "ansi"
    },
    {
      "abbreviation": "",
      "all_forms": [
        "KVALUE"
      ],
      "canonical": "KVALUE",
      "standard_status": "ansi"
    },
    {
      "abbreviation": "L",
      "all_forms": [
        "L",
        "LO",
        "LOC",
        "LOCK"
      ],
      "canonical": "LOCK",
      "standard_status": "ansi"
    },
    {
      "abbreviation": "M",
      "all_forms": [
        "M",
        "ME",
        "MER",
        "MERG",
        "MERGE"
      ],
      "canonical": "MERGE",
      "standard_status": "ansi"
    },
    {
      "abbreviation": "N",
      "all_forms": [
        "N",
        "NE",
        "NEW"
      ],
      "canonical": "NEW",
      "standard_status": "ansi"
    },
    {
      "abbreviation": "O",
      "all_forms": [
        "O",
        "OP",
        "OPE",
        "OPEN"
      ],
      "canonical": "OPEN",
      "standard_status": "ansi"
    },
    {
      "abbreviation": "",
      "all_forms": [
        "PRINT"
      ],
      "canonical": "PRINT",
      "standard_status": "iris-extension"
    },
    {
      "abbreviation": "Q",
      "all_forms": [
        "Q",
        "QU",
        "QUI",
        "QUIT"
      ],
      "canonical": "QUIT",
      "standard_status": "ansi"
    },
    {
      "abbreviation": "R",
      "all_forms": [
        "R",
        "RE",
        "REA",
        "READ"
      ],
      "canonical": "READ",
      "standard_status": "ansi"
    },
    {
      "abbreviation": "",
      "all_forms": [
        "RETURN"
      ],
      "canonical": "RETURN",
      "standard_status": "iris-extension"
    },
    {
      "abbreviation": "",
      "all_forms": [
        "RLOAD"
      ],
      "canonical": "RLOAD",
      "standard_status": "ansi"
    },
    {
      "abbreviation": "",
      "all_forms": [
        "RSAVE"
      ],
      "canonical": "RSAVE",
      "standard_status": "ansi"
    },
    {
      "abbreviation": "S",
      "all_forms": [
        "S",
        "SE",
        "SET"
      ],
      "canonical": "SET",
      "standard_status": "ansi"
    },
    {
      "abbreviation": "TC",
      "all_forms": [
        "TC",
        "TCO",
        "TCOM",
        "TCOMM",
        "TCOMMI",
        "TCOMMIT"
      ],
      "canonical": "TCOMMIT",
      "standard_status": "ansi"
    },
    {
      "abbreviation": "",
      "all_forms": [
        "THEN"
      ],
      "canonical": "THEN",
      "standard_status": "ansi"
    },
    {
      "abbreviation": "",
      "all_forms": [
        "THROW"
      ],
      "canonical": "THROW",
      "standard_status": "iris-extension"
    },
    {
      "abbreviation": "TRE",
      "all_forms": [
        "TRE",
        "TRES",
        "TREST",
        "TRESTA",
        "TRESTAR",
        "TRESTART"
      ],
      "canonical": "TRESTART",
      "standard_status": "ansi"
    },
    {
      "abbreviation": "TRO",
      "all_forms": [
        "TRO",
        "TROL",
        "TROLL",
        "TROLLB",
        "TROLLBA",
        "TROLLBAC",
        "TROLLBACK"
      ],
      "canonical": "TROLLBACK",
      "standard_status": "ansi"
    },
    {
      "abbreviation": "",
      "all_forms": [
        "TRY"
      ],
      "canonical": "TRY",
      "standard_status": "iris-extension"
    },
    {
      "abbreviation": "TS",
      "all_forms": [
        "TS",
        "TST",
        "TSTA",
        "TSTAR",
        "TSTART"
      ],
      "canonical": "TSTART",
      "standard_status": "ansi"
    },
    {
      "abbreviation": "U",
      "all_forms": [
        "U",
        "US",
        "USE"
      ],
      "canonical": "USE",
      "standard_status": "ansi"
    },
    {
      "abbreviation": "V",
      "all_forms": [
        "V",
        "VI",
        "VIE",
        "VIEW"
      ],
      "canonical": "VIEW",
      "standard_status": "ansi"
    },
    {
      "abbreviation": "",
      "all_forms": [
        "WHILE"
      ],
      "canonical": "WHILE",
      "standard_status": "iris-extension"
    },
    {
      "abbreviation": "W",
      "all_forms": [
        "W",
        "WR",
        "WRI",
        "WRIT",
        "WRITE"
      ],
      "canonical": "WRITE",
      "standard_status": "ansi"
    },
    {
      "abbreviation": "X",
      "all_forms": [
        "X",
        "XE",
        "XEC",
        "XECU",
        "XECUT",
        "XECUTE"
      ],
      "canonical": "XECUTE",
      "standard_status": "ansi"
    },
    {
      "abbreviation": "",
      "all_forms": [
        "Z"
      ],
      "canonical": "Z",
      "standard_status": "ansi"
    },
    {
      "abbreviation": "ZA",
      "all_forms": [
        "ZA",
        "ZAL",
        "ZALL",
        "ZALLO",
        "ZALLOC",
        "ZALLOCA",
        "ZALLOCAT",
        "ZALLOCATE"
      ],
      "canonical": "ZALLOCATE",
      "standard_status": "ydb-extension"
    },
    {
      "abbreviation": "ZB",
      "all_forms": [
        "ZB",
        "ZBR",
        "ZBRE",
        "ZBREA",
        "ZBREAK"
      ],
      "canonical": "ZBREAK",
      "standard_status": "multi-vendor-ext"
    },
    {
      "abbreviation": "ZCOM",
      "all_forms": [
        "ZCOM",
        "ZCOMP",
        "ZCOMPI",
        "ZCOMPIL",
        "ZCOMPILE"
      ],
      "canonical": "ZCOMPILE",
      "standard_status": "ydb-extension"
    },
    {
      "abbreviation": "ZC",
      "all_forms": [
        "ZC",
        "ZCO",
        "ZCON",
        "ZCONT",
        "ZCONTI",
        "ZCONTIN",
        "ZCONTINU",
        "ZCONTINUE"
      ],
      "canonical": "ZCONTINUE",
      "standard_status": "ydb-extension"
    },
    {
      "abbreviation": "ZD",
      "all_forms": [
        "ZD",
        "ZDE",
        "ZDEA",
        "ZDEAL",
        "ZDEALL",
        "ZDEALLO",
        "ZDEALLOC",
        "ZDEALLOCA",
        "ZDEALLOCAT",
        "ZDEALLOCATE"
      ],
      "canonical": "ZDEALLOCATE",
      "standard_status": "ydb-extension"
    },
    {
      "abbreviation": "ZED",
      "all_forms": [
        "ZED",
        "ZEDI",
        "ZEDIT"